ai,"코딩, 학습, 기업, 튜터, 수학, 로고, 기술, 사진, 교육, 모델, 로봇, 챗봇, 사진, 그림"
출시 ,"출시일, 애플, 순서, 신제품, 삼성, 컨설팅, crm, 경제뉴스, 광고, 마케팅"
개발,"계발, 개발자, 앱, 웹개발자, 웹개발, 앱개발자, 게임, 프로그램, 메뉴, 어플, 제품, ai"
코딩,"클론코딩, 앱, 코딩책, 게임, 독학, 코딩수업, 유아코딩, 로봇, 블록, 교육, 생활코딩, 프로그램, 자격증"
클라우드,"웹툰, 게임, 아마존클라우드, 클라우드엔지니어, 바우처, 추천, 크라우드소싱, kt, 서비스, 클라우드컴퓨팅, 복구, 구글, 메가존, 사진, 네이버클라우드"
공개,"리뷰삭제, 저작"
서비스,"기업, 이동서비스, 챗봇, 대행, 교육, 기획자, 고객, 기획, 서비스센터"
언어,"연결, 연결어미, 연결어"
프로그래밍,"노트북, 수학, 바이오프로그래밍, 추천, 자바, 책, 게임프로그래밍, 자격증, 파이썬, 컴퓨터프로그래밍, 언어, 학원, 연봉, R, 프로그램개발, 프로그램"
기반,"목적기반모빌리티, 기반시설, 네트워크, 위포트, 공기업, 직업기초능력평가, 자기소개서, ncs"
트렌드,"분석, 소비, 투자, 2023트렌드, 트렌드메카, 썸트렌드"
솔루션,"트래킹솔루션, 도매솔루션, 리뷰솔루션, 사이트솔루션, 솔루션개발, 솔루션업체, CMS솔루션, 솔루션사이트, 대학교솔루션, 솔루션회사, bi, 데이타솔루션"
플랫폼,"노코드, o2o, 부동산, 여행, 중고차, 기업"
인기,"해외, 국내, 추천"
기술,"전수, 기술교육, 기술창업, IT기술, 기술직"
보안,"경비,국방모바일,폴더,정보,사이버,네트워크,서버,업체,카드,기사,네이버,관제"
데이터,"라벨링, 빅데이터, 마이데이터, 쉐어링, 제로페이, 아이폰, 공공데이터, 데이터베이스, 갤럭시, 데이터마이닝, 테더링, 데이터분석"
티오베,
지수,"주식, 해외지수, 지수함수, 매수, 종합지수, 주가지수, 코스피, 나스닥다우, 다우"
PyPL,"PYPLYN, 전망, 주가"
랭킹,네이버
발표,"연습, 2030엑스포, 금리, FOMC발표, 엑스포, CPI발표"
체결,"주식, 볼트, 수의계약, 계약, MOU"
위한,
지원,"기업지원, 고용지원, 국가지원, 지원사업, 정부지원, 창업지원, 중소기업, 창업, 소상공인, 지원금"
맞손,
시장,
기업,"중소, 사업, 중견, 유니콘, 정보, 분석, 리뷰, 검색, 1인, 가치, 창업"
사업,"계획, 분야, 종류, 개인사업, 동업, 청년사업, 지원사업, 창업"
메타버스,"zep, 책, 전시회, 메타버스아카데미, 박람회, 게임, 교육, 멀티메타버스, 플랫폼, 엑스포, 관련주, 뜻, 메타버스2"
